,text
1203,"If you're still up, maybe leave the credit card so I can get gas when I get back like he told me to"
1204,"Call me, i am senthil from hsbc."
1205,"Do whatever you want. You know what the rules are. We had a talk earlier this week about what had to start happening, you showing responsibility. Yet, every week it's can i bend the rule this way? What about that way? Do whatever. I'm tired of having thia same argument with you every week. And a  &lt;#&gt;  movie DOESNT inlude the previews. You're still getting in after 1."
1206,And several to you sir.
1207,"That's cool, I'll come by like  &lt;#&gt; ish"
1208,"SMS SERVICES. for your inclusive text credits, pls goto www.comuk.net login= 3qxj9 unsubscribe with STOP, no extra charge. help 08702840625.COMUK. 220-CM2 9AE"
1209,Will be office around 4 pm. Now i am going hospital.
1210,Even my brother is not like to speak with me. They treat me like aids patent.
1211,Cause I'm not freaky lol
1212,I got lousy sleep. I kept waking up every 2 hours to see if my cat wanted to come in. I worry about him when its cold :(
1213,Ok i've sent u da latest version of da project.
1214,"Hmm... Dunno leh, mayb a bag 4 goigng out dat is not too small. Or jus anything except perfume, smth dat i can keep."
1215,"Sorry I flaked last night, shit's seriously goin down with my roommate, what you up to tonight?"
1216,I pocked you up there before
1217,Hello hun how ru? Its here by the way. Im good. Been on 2 dates with that guy i met in walkabout so far. We have to meet up soon. Hows everyone else?
1218,Any way where are you and what doing.
1219,"That's fine, I'll bitch at you about it later then"
1220,HI ITS KATE CAN U GIVE ME A RING ASAP XXX
1221,Nope wif my sis lor... Aft bathing my dog then i can bathe... Looks like it's going 2 rain soon.
1222,"Friendship is not a game to play, It is not a word to say, It doesn\'t start on March and ends on May, It is tomorrow, yesterday, today and e"
1223,PRIVATE! Your 2003 Account Statement for shows 800 un-redeemed S. I. M. points. Call 08715203652 Identifier Code: 42810 Expires 29/10/0
1224,I gotta collect da car at 6 lei.
1225,Haf u eaten? Wat time u wan me 2 come?
1226,"I don't have anybody's number, I still haven't thought up a tactful way to ask alex"
1227,The greatest test of courage on earth is to bear defeat without losing heart....gn tc
1228,FREE for 1st week! No1 Nokia tone 4 ur mob every week just txt NOKIA to 8007 Get txting and tell ur mates www.getzed.co.uk POBox 36504 W45WQ norm150p/tone 16+
1229,Raviyog Peripherals bhayandar east
1230,Howz pain?hope u r fine..
1231,Kinda. First one gets in at twelve! Aah. Speak tomo
1232,I don't know u and u don't know me. Send CHAT to 86688 now and let's find each other! Only 150p/Msg rcvd. HG/Suite342/2Lands/Row/W1J6HL LDN. 18 years or over.
1233,I will vote for wherever my heart guides me
1234,Anything lor is she coming?
1235,how tall are you princess?
1236,"Sorry, I'll call later"
1237,I'm in school now n i'll be in da lab doing some stuff give me a call when Ì_ r done.
1238,"Yeah hopefully, if tyler can't do it I could maybe ask around a bit"
1239,Waiting for your call.
1240,How much are we getting?
1241,Well welp is sort of a semiobscure internet thing
1242,Hi babe its me thanks for coming even though it didnt go that well!i just wanted my bed! Hope to see you soon love and kisses xxx
1243,"Uncle G, just checking up on you. Do have a rewarding month"
1244,Whom you waited for yesterday
1245,Ur ringtone service has changed! 25 Free credits! Go to club4mobiles.com to choose content now! Stop? txt CLUB STOP to 87070. 150p/wk Club4 PO Box1146 MK45 2WT
1246,Message Important information for O2 user. Today is your lucky day! 2 find out why log onto http://www.urawinner.com there is a fantastic surprise awaiting you
1247,Still in the area of the restaurant. Ill try to come back soon
1248,IMPORTANT MESSAGE. This is a final contact attempt. You have important messages waiting out our customer claims dept. Expires 13/4/04. Call 08717507382 NOW!
1249,Did either of you have any idea's? Do you know of anyplaces doing something?
1250,Customer place i will call you.
1251,how are you? I miss you!
1252,"Goodmorning,my grandfather expired..so am on leave today."
1253,Yeah so basically any time next week you can get away from your mom &amp; get up before 3
1254,"New Theory: Argument wins d SITUATION, but loses the PERSON. So dont argue with ur friends just.. . . . kick them &amp; say, I'm always correct.!"
1255,Get ready to put on your excellent sub face :)
1256,Hiya. How was last night? I've been naughty and bought myself clothes and very little ... Ready for more shopping tho! What kind of time do you wanna meet?
1257,Both :) i shoot big loads so get ready!
1258,"January Male Sale! Hot Gay chat now cheaper, call 08709222922. National rate from 1.5p/min cheap to 7.8p/min peak! To stop texts call 08712460324 (10p/min)"
1259,"Hey...Great deal...Farm tour 9am to 5pm $95/pax, $50 deposit by 16 May"
1260,Ard 530 like dat lor. We juz meet in mrt station then Ì_ dun haf to come out.
1261,Yeah right! I'll bring my tape measure fri!
1262,"\Are you comingdown later?\"""""
1263,How much u trying to get?
1264,Pls dont forget to study
1265,My sort code is  and acc no is . The bank is natwest. Can you reply to confirm i've sent this to the right person!
1266,You bad girl. I can still remember them
1267,Well done ENGLAND! Get the official poly ringtone or colour flag on yer mobile! text TONE or FLAG to 84199 NOW! Opt-out txt ENG STOP. Box39822 W111WX å£1.50
1268,Maybe i could get book out tomo then return it immediately ..? Or something.
1269,URGENT! Your Mobile number has been awarded with a å£2000 prize GUARANTEED. Call 09058094454 from land line. Claim 3030. Valid 12hrs only
1270,"Sorry, I can't help you on this."
1271,"\HELLO U.CALL WEN U FINISH WRK.I FANCY MEETIN UP WIV U ALL TONITE AS I NEED A BREAK FROM DABOOKS. DID 4 HRS LAST NITE+2 TODAY OF WRK!\"""""
1272,"Its ok chikku, and its my 1 of favourite song..:-)"
1273,Thank You meet you monday
1274,Wat time Ì_ wan today?
1275,"Hiya, probably coming home * weekend after next"
1276,"I know where the  &lt;#&gt;  is, I'll be there around 5"
1277,"The gas station is like a block away from my house, you'll drive right by it since armenia ends at swann and you have to take howard"
1278,I can ask around but there's not a lot in terms of mids up here
1279,"(No promises on when though, haven't even gotten dinner yet)"
1280,"Den only weekdays got special price... Haiz... Cant eat liao... Cut nails oso muz wait until i finish drivin wat, lunch still muz eat wat... "
1281,Bbq this sat at mine from 6ish. Ur welcome 2 come
1282,"Bloody hell, cant believe you forgot my surname Mr . Ill give u a clue, its spanish and begins with m... "
1283,"K, jason says he's gonna be around so I'll be up there around  &lt;#&gt;"
1284,"Yo, you gonna still be in stock tomorrow/today? I'm trying to get a dubsack"
1285,"Sorry, I'll call later"
1286,Sorry da..today i wont come to play..i have driving clas..
1287,Nah im goin 2 the wrks with j wot bout u?
1288,Ok... U enjoy ur shows...
1289,You can jot down things you want to remember later.
1290,So u workin overtime nigpun?
1291,"Good afternoon, my love. It was good to see your words on YM and get your tm. Very smart move, my slave ... *smiles* ... I drink my coffee and await you."
1292,"Didn't try, g and I decided not to head out"
1293,"Go until jurong point, crazy.. Available only in bugis n great world la e buffet... Cine there got amore wat..."
1294,See? I thought it all through
1295,U ned to convince him tht its not possible witot hurting his feeling its the main
1296,Want a new Video Phone? 750 anytime any network mins? Half price line rental free text for 3 months? Reply or call 08000930705 for free delivery
1297, and  picking them up from various points
1298,Send his number and give reply tomorrow morning for why you said that to him like that ok
1299,Was actually sleeping and still might when u call back. So a text is gr8. You rock sis. Will send u a text wen i wake.
1300,"Sorry, it's a lot of friend-of-a-friend stuff, I'm just now about to talk to the actual guy who wants to buy"
1301,What time should I tell my friend to be around?
1302,"\Getting tickets 4 walsall tue 6 th march. My mate is getting me them on sat. ill pay my treat. Want 2 go. Txt bak .Terry\"""""
1303,"Sorry,  in meeting I'll call you later"
1304,Your opinion about me? 1. Over 2. Jada 3. Kusruthi 4. Lovable 5. Silent 6. Spl character 7. Not matured 8. Stylish 9. Simple Pls reply..
1305,"He has lots of used ones babe, but the model doesn't help. Youi have to bring it over and he'll match it up"
1306,Ur cash-balance is currently 500 pounds - to maximize ur cash-in now send GO to 86688 only 150p/msg. CC 08718720201 HG/Suite342/2Lands Row/W1J6HL
1307,Thanks for loving me so. You rock
1308,excellent. I spent  &lt;#&gt;  years in the Air Force. Iraq and afghanistan. I am stable and honest. do you like traveling?
1309,R Ì_ comin back for dinner?
1310,Yup he msg me: is tat yijue? Then i tot it's my group mate cos we meeting today mah... I'm askin if Ì_ leaving earlier or wat mah cos mayb Ì_ haf to walk v far...
1311,"Plz note: if anyone calling from a mobile Co. &amp; asks u to type # &lt;#&gt;  or # &lt;#&gt; . Do not do so. Disconnect the call,coz it iz an attempt of 'terrorist' to make use of the sim card no. Itz confirmd by nokia n motorola n has been verified by CNN IBN."
1312,I want to be there so i can kiss you and feel you next to me
1313,i can call in  &lt;#&gt;  min if thats ok
1314,Tomorrow i am not going to theatre. . . So i can come wherever u call me. . . Tell me where and when to come tomorrow
1315,Update_Now - 12Mths Half Price Orange line rental: 400mins...Call MobileUpd8 on 08000839402 or call2optout=J5Q
1316,Hi! You just spoke to MANEESHA V. We'd like to know if you were satisfied with the experience. Reply Toll Free with Yes or No.
1317,"Nah, Wednesday. When should I bring the mini cheetos bag over?"
1318,I wish! I don't think its gonna snow that much. But it will be more than those flurries we usually get that melt before they hit the ground. Eek! We haven't had snow since &lt;#&gt; before I was even born!
1319,IÛ÷ll have a look at the frying pan in case itÛ÷s cheap or a book perhaps. No thatÛ÷s silly a frying pan isnÛ÷t likely to be a book
1320,Yun buying... But school got offer 2000 plus only...
1321,"Yeah, probably but not sure. Ilol let u know, but personally I wuldnt bother, then again if ur goin to then I mite as well!!"
1322,"ou are guaranteed the latest Nokia Phone, a 40GB iPod MP3 player or a å£500 prize! Txt word: COLLECT to No: 83355! IBHltd LdnW15H 150p/Mtmsgrcvd18"
1323,Yeah jay's sort of a fucking retard
1324,I am not at all happy with what you saying or doing
1325,Fine am simply sitting.
1326,How much r Ì_ willing to pay?
1327,Serious? What like proper tongued her
1328,"Had your contract mobile 11 Mnths? Latest Motorola, Nokia etc. all FREE! Double Mins & Text on Orange tariffs. TEXT YES for callback, no to remove from records"
1329,i am going to bed now prin
1330,Summers finally here! Fancy a chat or flirt with sexy singles in yr area? To get MATCHED up just reply SUMMER now. Free 2 Join. OptOut txt STOP Help08714742804
1331,"I didnt get ur full msg..sometext is missing, send it again"
1332,I wait 4 Ì_ inside da car park...
1333,Oh oh... Den muz change plan liao... Go back have to yan jiu again...
1334,"Same here, but I consider walls and bunkers and shit important just because I never play on peaceful but I guess your place is high enough that it don't matter"
1335,India have to take lead:)
1336,Sos! Any amount i can get pls.
1337,Ok no prob
1338,Yo! Howz u? girls never rang after india. L
1339,"Cant believe i said so many things to you this morning when all i really wanted to say was good morning, i love you! Have a beautiful morning. See you in the library later."
1340,URGENT! We are trying to contact U. Todays draw shows that you have won a å£800 prize GUARANTEED. Call 09050003091 from land line. Claim C52. Valid 12hrs only
1341,Dunno y u ask me.
1342,I don't run away frm u... I walk slowly &amp; it kills me that u don't care enough to stop me...
1343,ree entry in 2 a weekly comp for a chance to win an ipod. Txt POD to 80182 to get entry (std txt rate) T&C's apply 08452810073 for details 18+
1344,My planning usually stops at \find hella weed
1345,I just saw ron burgundy captaining a party boat so yeah
1346,Ok ill tell the company
1347,Ok both our days. So what are you making for dinner tonite? Am I invited?
1348,Dont let studying stress you out. L8r.
1349,I don't run away frm u... I walk slowly &amp; it kills me that u don't care enough to stop me...
1350,Annoying isn't it.
1351,Hi here. have birth at on the  to  at 8lb 7oz. Mother and baby doing brilliantly.
1352,It will stop on itself. I however suggest she stays with someone that will be able to give ors for every stool.
1353,I wonder if you'll get this text?
1354,"our mobile number has won å£5000, to claim calls us back or ring the claims hot line on 09050005321."
1355,+123 Congratulations - in this week's competition draw u have won the å£1450 prize to claim just call 09050002311 b4280703. T&Cs/stop SMS 08718727868. Over 18 only 150ppm
1356,For sale - arsenal dartboard. Good condition but no doubles or trebles!
1357,Lol! U drunkard! Just doing my hair at d moment. Yeah still up 4 tonight. Wats the plan? 
1358,"Babe, I'm back ... Come back to me ..."
1359,"Ya, i'm referin to mei's ex wat... No ah, waitin 4 u to treat, somebody shld b rich liao...So gd, den u dun have to work frm tmr onwards..."
1360,Its on in engalnd! But telly has decided it won't let me watch it and mia and elliot were kissing! Damn it!
1361,"Dear, will call Tmorrow.pls accomodate."
1362,Text her. If she doesnt reply let me know so i can have her log in
1363,So what u doing today?
1364,Huh but i got lesson at 4 lei n i was thinkin of going to sch earlier n i tot of parkin at kent vale...  
1365,Er mw im filled tuth is aight
1366,How much did ur hdd casing cost.
1367,"Had your mobile 10 mths? Update to the latest Camera/Video phones for FREE. KEEP UR SAME NUMBER, Get extra free mins/texts. Text YES for a call"
1368,Wherre's my boytoy ? :-(
1369,"FreeMsg: Claim ur 250 SMS messages-Text OK to 84025 now!Use web2mobile 2 ur mates etc. Join Txt250.com for 1.50p/wk. T&C BOX139, LA32WU. 16 . Remove txtX or stop"
1370,"It doesnt make sense to take it there unless its free. If you need to know more, wikipedia.com"
1371,I tot u outside cos darren say u come shopping. Of course we nice wat. We jus went sim lim look at mp3 player.
1372,Ok then i will come to ur home after half an hour
1373,I notice you like looking in the shit mirror youre turning into a right freak
1374,"Best msg: It's hard to be with a person, when u know that one more step foward will make u fall in love.. &amp; One step back can ruin ur friendship.. good night:-) ..."
1375,"Good evening Sir, hope you are having a nice day. I wanted to bring it to your notice that I have been late in paying rent for the past few months and have had to pay a $ &lt;#&gt;  charge. I felt it would be inconsiderate of me to nag about something you give at great cost to yourself and that's why i didnt speak up. I however am in a recession and wont be able to pay the charge this month hence my askin well ahead of month's end. Can you please help. Thank you for everything."
1376,HEY MATE! HOWS U HONEY?DID U AVE GOOD HOLIDAY? GIMMI DE GOSS!x
1377,Where u been hiding stranger?
1378,O ic lol. Should play 9 doors sometime yo
1379,"Alright omw, gotta change my order to a half8th"
1380,Baaaaaaaabe! Wake up ! I miss you ! I crave you! I need you!
1381,Ok i shall talk to him
1382,Ok
1383,Wake me up at  &lt;#&gt;  am morning:)
1384,Call from 08702490080 - tells u 2 call 09066358152 to claim å£5000 prize. U have 2 enter all ur mobile & personal details @ the prompts. Careful!
1385,"Hi, my love! How goes that day? Fuck, this morning I woke and dropped my cell on the way down the stairs but it seems alright ... *phews* I miss you !"
1386,"Wan2 win a Meet+Greet with Westlife 4 U or a m8? They are currently on what tour? 1)Unbreakable, 2)Untamed, 3)Unkempt. Text 1,2 or 3 to 83049. Cost 50p +std text"
1387,Great to hear you are settling well. So what's happenin wit ola?
1388,"Storming msg: Wen u lift d phne, u say \HELLO\"" Do u knw wt is d real meaning of HELLO?? . . . It's d name of a girl..! . . . Yes.. And u knw who is dat girl?? \""Margaret Hello\"" She is d girlfrnd f Grahmbell who invnted telphone... . . . . Moral:One can 4get d name of a person"
1389,"\NOT ENUFCREDEIT TOCALL.SHALL ILEAVE UNI AT 6 +GET A BUS TO YOR HOUSE?\"""""
1390,"Under the sea, there lays a rock. In the rock, there is an envelope. In the envelope, there is a paper. On the paper, there are 3 words... '"
1391,Am not working but am up to eyes in philosophy so will text u later when a bit more free for chat...
1392,Its ok..come to my home it vl nice to meet and v can chat..
1393,Your board is working fine. The issue of overheating is also reslove. But still software inst is pending. I will come around 8'o clock.
1394,LOL what happens in Vegas stays in vegas
1395,Great NEW Offer - DOUBLE Mins & DOUBLE Txt on best Orange tariffs AND get latest camera phones 4 FREE! Call MobileUpd8 free on 08000839402 NOW! or 2stoptxt T&Cs
1396,Let's pool our money together and buy a bunch of lotto tickets. If we win I get &lt;#&gt; % u get &lt;#&gt; %. Deal?
1397,What i mean is do they come chase you out when its over or is it stated you can watch as many movies as you want.
1398,"Hey babe, my friend had to cancel, still up for a visit ?"
1399,Sorry * was at the grocers.
1400,"FR'NDSHIP is like a needle of a clock. Though V r in d same clock, V r nt able 2 met. Evn if V meet,itz only 4few seconds. Bt V alwys stay conected. Gud 9t;-)"
1401,Me hungry buy some food good lei... But mum n yun dun wan juz buy a little bit... 
1402,Can i meet Ì_ at 5.. As 4 where depends on where Ì_ wan 2 in lor..
1403,We tried to contact you re your reply to our offer of a Video Handset? 750 anytime any networks mins? UNLIMITED TEXT? Camcorder? Reply or call 08000930705 NOW
1404,"Living is very simple.. Loving is also simple.. Laughing is too simple.. Winning is tooo simple.. But, being 'SIMPLE' is very difficult.. Gud nte.:-"
1405,Ya very nice. . .be ready on thursday
1406,I wnt to buy a BMW car urgently..its vry urgent.but hv a shortage of  &lt;#&gt; Lacs.there is no source to arng dis amt. &lt;#&gt; lacs..thats my prob
1407,"Urgent UR awarded a complimentary trip to EuroDisinc Trav, Aco&Entry41 Or å£1000. To claim txt DIS to 87121 18+6*å£1.50(moreFrmMob. ShrAcomOrSglSuplt)10, LS1 3AJ"
1408,MAYBE IF YOU WOKE UP BEFORE FUCKING 3 THIS WOULDN'T BE A PROBLEM.
1409,Ok lor...
1410,Haha i think i did too
1411,As in different styles?
1412,Dear :-/ why you mood off. I cant drive so i brother to drive
1413,Good afternoon starshine! How's my boytoy? Does he crave me yet? Ache to fuck me ? *sips cappuccino* I miss you babe *teasing kiss*
1414,Reply with your name and address and YOU WILL RECEIVE BY POST a weeks completely free accommodation at various global locations www.phb1.com ph:08700435505150p
1415,Ok. Very good. Its all about making that money.
1416,No. Yes please. Been swimming?
1417,V nice! Off 2 sheffield tom 2 air my opinions on categories 2 b used 2 measure ethnicity in next census. Busy transcribing. :-)
1418,"It,,s a taxt massage....tie-pos argh ok! Lool!"
1419,ÌÏ ready then call me...
1420,"Hiya , have u been paying money into my account? If so, thanks. Got a pleasant surprise when i checked my balance -u c, i don't get statements 4 that acc"
1421,We are supposed to meet to discuss abt our trip... Thought xuhui told you? In the afternoon. Thought we can go for lesson after that
1422,Your weekly Cool-Mob tones are ready to download !This weeks new Tones include: 1) Crazy Frog-AXEL F>>> 2) Akon-Lonely>>> 3) Black Eyed-Dont P >>>More info in n
1423,Ha ha - had popped down to the loo when you hello-ed me. Hello!
1424,And is there a way you can send shade's stuff to her. And she has been wonderful too.
1425,"You are always putting your business out there. You put pictures of your ass on facebook. You are one of the most open people i've ever met. Why would i think a picture of your room would hurt you, make you feel violated."
1426,I'm already back home so no probably not
1427,Holy living christ what is taking you so long
1428,Where do you need to go to get it?
1429,No did you check? I got his detailed message now
1430,"Yeah, where's your class at?"
1431,But really quite funny lor wat... Then u shd haf run shorter distance wat...
1432,Another month. I need chocolate weed and alcohol.
1433,At home by the way
1434,Your daily text from me ÛÒ a favour this time
1435,FreeMsg>FAV XMAS TONES!Reply REAL
1436,Ok i am on the way to home hi hi
1437,"K.. I yan jiu liao... Sat we can go 4 bugis vill one frm 10 to 3 den hop to parco 4 nb. Sun can go cine frm 1030 to 2, den hop to orc mrt 4 hip hop at 4..."
1438,Not to worry. I'm sure you'll get it.
1439,"Night sweet, sleep well! I've just been to see The Exorcism of Emily Rose and may never sleep again! Hugs and snogs! "
1440,RECPT 1/3. You have ordered a Ringtone. Your order is being processed...
1441,Goin to workout lor... Muz lose e fats... 
1442,URGENT! Your Mobile number has been awarded with a å£2000 prize GUARANTEED. Call 09058094455 from land line. Claim 3030. Valid 12hrs only
1443,"The word \Checkmate\"" in chess comes from the Persian phrase \""Shah Maat\"" which means; \""the king is dead..\"" Goodmorning.. Have a good day..:)"""
1444,Wah... Okie okie... Muz make use of e unlimited... Haha... 
1445,Free video camera phones with Half Price line rental for 12 mths and 500 cross ntwk mins 100 txts. Call MobileUpd8 08001950382 or Call2OptOut/674
1446,I think chennai well settled?
1447,"chile, please! It's only a  &lt;DECIMAL&gt;  hour drive for me. I come down all the time and will be subletting feb-april for audition season."
1448,"The  &lt;#&gt; g that i saw a few days ago, the guy wants sell wifi only for  &lt;#&gt;  and with 3g for  &lt;#&gt; . That's why i blanked him."
1449,"Sorry, I'll call later"
1450,Last chance 2 claim ur å£150 worth of discount vouchers-Text YES to 85023 now!SavaMob-member offers mobile T Cs 08717898035. å£3.00 Sub. 16 . Remove txt X or STOP
1451,"Fighting with the world is easy, u either win or lose bt fightng with some1 who is close to u is dificult if u lose - u lose if u win - u still lose."
1452,"Sir, Waiting for your mail."
1453,Double Mins & Double Txt & 1/2 price Linerental on Latest Orange Bluetooth mobiles. Call MobileUpd8 for the very latest offers. 08000839402 or call2optout/LF56
1454,"Now u sound like manky scouse boy steve,like! I is travelling on da bus home.wot has u inmind 4 recreation dis eve?"
1455,December only! Had your mobile 11mths+? You are entitled to update to the latest colour camera mobile for Free! Call The Mobile Update Co FREE on 08002986906
1456,<Forwarded from 88877>FREE entry into our å£250 weekly comp just send the word ENTER to 88877 NOW. 18 T&C www.textcomp.com
1457,My friends use to call the same.
1458,What * u wearing?
1459,Here got lots of hair dresser fr china.
1460,sexy sexy cum and text me im wet and warm and ready for some porn! u up for some fun? THIS MSG IS FREE RECD MSGS 150P INC VAT 2 CANCEL TEXT STOP
1461,Yes:)sura in sun tv.:)lol.
1462,Ugh hopefully the asus ppl dont randomly do a reformat.
1463,"Imagine you finally get to sink into that bath after I have put you through your paces, maybe even having you eat me for a while before I left ... But also imagine the feel of that cage on your cock surrounded by the bath water, reminding you always who owns you ... Enjoy, my cuck"
1464,"Erm Û_ ill pick you up at about 6.45pm. That'll give enough time to get there, park and that."
1465,From tomorrow onwards eve 6 to 3 work.
1466,Chk in ur belovd ms dict
1467,I am hot n horny and willing I live local to you - text a reply to hear strt back from me 150p per msg Netcollex LtdHelpDesk: 02085076972 reply Stop to end
1468,Cool. I am  &lt;#&gt;  inches long. hope you like them big!
1469,Gudnite....tc...practice going on
1470,Shall call now dear having food
1471,"Hottest pics straight to your phone!! See me getting Wet and Wanting, just for you xx Text PICS to 89555 now! txt costs 150p textoperator g696ga 18 XxX"
1472,I have no idea where you are
1473,"Oh yes, why is it like torture watching england?"
1474,You know my old Dom I told you about yesterday ? His name is Roger? He got in touch with me last night and wants me to meet him today at 2 pm
1475,We currently have a message awaiting your collection. To collect your message just call 08718723815.
1476,Ok pa. Nothing problem:-)
1477,Think you sent the text to the home phone. That cant display texts. If you still want to send it his number is
1478,I had askd u a question some hours before. Its answer
1479,"I can make it up there, squeezed  &lt;#&gt;  bucks out of my dad"
1480,What do u want when i come back?.a beautiful necklace as a token of my heart for you.thats what i will give but ONLY to MY WIFE OF MY LIKING.BE THAT AND SEE..NO ONE can give you that.dont call me.i will wait till i come.
1481,S:)8 min to go for lunch:)
1482,I have to take exam with in march 3
1483,Already am squatting is the new way of walking
1484,will you like to be spoiled? :)
