,text
2963,"New Mobiles from 2004, MUST GO! Txt: NOKIA to No: 89545 & collect yours today! From ONLY å£1. www.4-tc.biz 2optout 087187262701.50gbp/mtmsg18 TXTAUCTION."
2964,Are you sure you don't mean \get here
2965,You can never do NOTHING
2966,Pick you up bout 7.30ish? What time are  and that going?
2967,my ex-wife was not able to have kids. Do you want kids one day?
2968,"I don't know, same thing that's wrong everyso often, he panicks starts goin on bout not bein good enough Û_"
2969,Yeh. Indians was nice. Tho it did kane me off a bit he he. We shud go out 4 a drink sometime soon. Mite hav 2 go 2 da works 4 a laugh soon. Love Pete x x
2970,Somebody set up a website where you can play hold em using eve online spacebucks
2971,Honestly i've just made a lovely cup of tea and promptly dropped my keys in it and then burnt my fingers getting them out!
2972,Just buy a pizza. Meat lovers or supreme. U get to pick.
2973,"\For the most sparkling shopping breaks from 45 per person; call 0121 2025050 or visit www.shortbreaks.org.uk\"""""
2974,3. You have received your mobile content. Enjoy
2975,"You've won tkts to the EURO2004 CUP FINAL or å£800 CASH, to collect CALL 09058099801 b4190604, POBOX 7876150ppm"
2976,No. It's not pride. I'm almost  &lt;#&gt;  years old and shouldn't be takin money from my kid. You're not supposed to have to deal with this stuff. This is grownup stuff--why i don't tell you.
2977,In which place i can get rooms cheap:-)
2978,Can come my room but cannot come my house cos my house still messy... Haha...
2979,But that's on ebay it might be less elsewhere.
2980,Joy's father is John. Then John is the NAME of Joy's father. Mandan
2981,HMV BONUS SPECIAL 500 pounds of genuine HMV vouchers to be won. Just answer 4 easy questions. Play Now! Send HMV to 86688 More info:www.100percent-real.com
2982,I was just callin to say hi. Take care bruv!
2983,Reverse is cheating. That is not mathematics.
2984,Lol enjoy role playing much?
2985,I need... Coz i never go before 
2986,"Today's Offer! Claim ur å£150 worth of discount vouchers! Text YES to 85023 now! SavaMob, member offers mobile! T Cs 08717898035. å£3.00 Sub. 16 . Unsub reply X"
2987,Leave it. U will always be ignorant.
2988,Okie
2989,"My sister in law, hope you are having a great month. Just saying hey. Abiola"
2990,Its too late:)but its k.wish you the same.
2991,Its a big difference.  &lt;#&gt;  versus  &lt;#&gt;  every  &lt;#&gt; hrs
2992,Are you available for soiree on June 3rd?
2993,"For ur chance to win a å£250 wkly shopping spree TXT: SHOP to 80878. T's&C's www.txt-2-shop.com custcare 08715705022, 1x150p/wk"
2994,Usually the person is unconscious that's in children but in adults they may just behave abnormally. I.ll call you now
2995,"complimentary 4 STAR Ibiza Holiday or å£10,000 cash needs your URGENT collection. 09066364349 NOW from Landline not to lose out! Box434SK38WP150PPM18+"
2996,Great! So what attracts you to the brothas?
2997,I had a good time too. Its nice to do something a bit different with my weekends for a change. See ya soon
2998,Jus telling u dat i'll b leaving 4 shanghai on 21st instead so we'll haf more time 2 meet up cya...
2999,No. I.ll meet you in the library
3000,Aah bless! How's your arm?
3001,"Aight, I'll ask a few of my roommates"
3002,All e best 4 ur driving tmr :-)
3003,Y?WHERE U AT DOGBREATH? ITS JUST SOUNDING LIKE JAN C THATåÕS AL!!!!!!!!!
3004,U horrible gal... U knew dat i was going out wif him yest n u still come n ask me...
3005,K.:)you are the only girl waiting in reception ah?
3006,"Sorry, I'll call later"
3007,Yup Ì_ not comin :-(
3008,Then wat r u doing now? Busy wif work?
3009,What time you think you'll have it? Need to know when I should be near campus
3010,"If e timing can, then i go w u lor..."
3011,"Hi hope u r both ok, he said he would text and he hasn't, have u seen him, let me down gently please "
3012,"Yes, princess. Are you going to make me moan?"
3013,"Sure thing big man. i have hockey elections at 6, shouldnÛ÷t go on longer than an hour though"
3014,"Yun ah.the ubi one say if Ì_ wan call by tomorrow.call 67441233 look for irene.ere only got bus8,22,65,61,66,382. Ubi cres,ubi tech park.6ph for 1st 5wkg days.Ì¬n"
3015,"Good good, billy mates all gone. Just been jogging, again! Did enjoy concert?"
3016,I dont have any of your file in my bag..i was in work when you called me.i 'll tell you if i find anything in my room.
3017,Gokila is talking with you aha:)
3018,"Claim a 200 shopping spree, just call 08717895698 now! Have you won! MobStoreQuiz10ppm"
3019,"That's cool he'll be here all night, lemme know when you're around"
3020,Have you emigrated or something? Ok maybe 5.30 was a bit hopeful...
3021,Long time. You remember me today.
3022,Okay lor... Wah... like that def they wont let us go... Haha... What did they say in the terms and conditions?
3023,Wot is u up 2 then bitch?
3024,NO GIFTS!! You trying to get me to throw myself off a cliff or something?
3025,These won't do. Have to move on to morphine
3026,Will be out of class in a few hours. Sorry
3027,I like to talk pa but am not able to. I dont know y.
3028,"Cool, we shall go and see, have to go to tip anyway. Are you at home, got something to drop in later? So lets go to town tonight! Maybe mum can take us in."
3029,That seems unnecessarily hostile
3030,S:)no competition for him.
3031,Oh unintentionally not bad timing. Great. Fingers  the trains play along! Will give fifteen min warning.
3032,Stupid.its not possible
3033,am up to my eyes in philosophy
3034,"Call me. I m unable to cal. Lets meet bhaskar, and deep"
3035,Who u talking about?
3036,Mm not entirely sure i understood that text but hey. Ho. Which weekend?
3037,"This is the 2nd time we have tried to contact u. U have won the å£400 prize. 2 claim is easy, just call 087104711148 NOW! Only 10p per minute. BT-national-rate"
3038,Hey ! Don't forget ... You are MINE ... For ME ... My possession ... MY property ... MMM ... *childish smile* ...
3039,"all the lastest from Stereophonics, Marley, Dizzee Racal, Libertines and The Strokes! Win Nookii games with Flirt!! Click TheMob WAP Bookmark or text WAP to 82468"
3040,"I'm back &amp; we're packing the car now, I'll let you know if there's room"
3041,Yup...
3042,She.s find. I sent you an offline message to know how anjola's now.
3043,Urgent Ur å£500 guaranteed award is still unclaimed! Call 09066368327 NOW closingdate04/09/02 claimcode M39M51 å£1.50pmmorefrommobile2Bremoved-MobyPOBox734LS27YF
3044,"A bit of Ur smile is my hppnss, a drop of Ur tear is my sorrow, a part of Ur heart is my life, a heart like mine wil care for U, forevr as my GOODFRIEND"
3045,"Yeah I think my usual guy's still passed out from last night, if you get ahold of anybody let me know and I'll throw down"
3046,"Every King Was Once A Crying Baby And Every Great Building Was Once A Map.. Not Imprtant Where U r TODAY, BUT Where U Wil Reach TOMORW. Gud ni8"
3047,Please CALL 08712402902 immediately as there is an urgent message waiting for you.
3048,Call me when you get the chance plz &lt;3
3049,IÛ÷m going to try for 2 months ha ha only joking
3050,Sat right? Okay thanks... 
3051,Gibbs unsold.mike hussey
3052,"When people see my msgs, They think Iam addicted to msging... They are wrong, Bcoz They don\'t know that Iam addicted to my sweet Friends..!! BSLVYL"
3053,Today am going to college so am not able to atten the class.
3054,"Im in inperialmusic listening2the weirdest track ever byåÓleafcutter johnåÓ-sounds like insects being molested&someone plumbing,remixed by evil men on acid!"
3055,Lol no. Just trying to make your day a little more interesting
3056,"Awesome, I'll see you in a bit"
3057,How are you. Wish you a great semester
3058,Hello which the site to download songs its urgent pls
3059,I will reach before ten morning
3060,Do you know where my lab goggles went
3061,Dad went out oredi... 
3062,Waiting in e car 4 my mum lor. U leh? Reach home already?
3063,Horrible gal. Me in sch doing some stuff. How come u got mc?
3064,Should i send you naughty pix? :)
3065,Ok ill send you with in  &lt;DECIMAL&gt;  ok.
3066,I don't quite know what to do. I still can't get hold of anyone. I cud pick you up bout 7.30pm and we can see if they're in the pub?
3067,Pass dis to all ur contacts n see wat u get! Red;i'm in luv wid u. Blue;u put a smile on my face. Purple;u r realy hot. Pink;u r so swt. Orange;i thnk i lyk u. Green;i realy wana go out wid u. Yelow;i wnt u bck. Black;i'm jealous of u. Brown;i miss you Nw plz giv me one color
3068,As one of our registered subscribers u can enter the draw 4 a 100 G.B. gift voucher by replying with ENTER. To unsubscribe text STOP
3069,Sunshine Quiz Wkly Q! Win a top Sony DVD player if u know which country the Algarve is in? Txt ansr to 82277. å£1.50 SP:Tyrone
3070,ÌÏ no home work to do meh... 
3071,The length is e same but e top shorter n i got a fringe now. I thk i'm not going liao. Too lazy. Dun wan 2 distract u also.
3072,I accidentally deleted the message. Resend please.
3073,Bishan lar nearer... No need buy so early cos if buy now i gotta park my car...
3074,"Beautiful Truth against Gravity.. Read carefully: \Our heart feels light when someone is in it.. But it feels very heavy when someone leaves it..\"" GOODMORNING"""
3075,Ya srsly better than yi tho
3076,Send me yetty's number pls.
3077,Jesus christ bitch I'm trying to give you drugs answer your fucking phone
3078,Mine here like all fr china then so noisy.
3079,K...k...when will you give treat?
3080,Miles and smiles r made frm same letters but do u know d difference..? smile on ur face keeps me happy even though I am miles away from u.. :-)keep smiling.. Good nyt
3081,Hey i'm bored... So i'm thinking of u... So wat r u doing?
3082,Hi Petey!noiåÕm ok just wanted 2 chat coz avent spoken 2 u 4 a long time-hope ur doin alrite.have good nit at js love ya am.x
3083,Go where n buy? Juz buy when we get there lar.
3084,Do you want a New Nokia 3510i colour phone DeliveredTomorrow? With 300 free minutes to any mobile + 100 free texts + Free Camcorder reply or call 08000930705.
3085,Aiya we discuss later lar... Pick Ì_ up at 4 is it?
3086,Having lunch:)you are not in online?why?
3087,* Am on my way
3088,Did you stitch his trouser
3089,"Sorry about earlier. Putting out fires.Are you around to talk after 9? Or do you actually have a life, lol!"
3090,You call times job today ok umma and ask them to speed up
3091,Hi did u decide wot 2 get 4 his bday if not ill prob jus get him a voucher frm virgin or sumfing 
3092,What can i do? Might accidant tookplace between somewhere ghodbandar rd. Traffic moves slovely. So plz slip &amp; don't worry.
3093,But i juz remembered i gotta bathe my dog today..
3094,A cute thought for friendship: \Its not necessary to share every secret with ur close Frnd
3095,Your pussy is perfect!
3096,"Just wondering, the others just took off"
3097,Well boy am I glad G wasted all night at applebees for nothing
3098,Slept? I thinkThis time ( &lt;#&gt;  pm) is not dangerous
3099,Nooooooo I'm gonna be bored to death all day. Cable and internet outage.
3100,Stupid auto correct on my phone
3101,That's my honeymoon outfit. :)
3102,"I'm eatin now lor, but goin back to work soon... E mountain deer show huh... I watch b4 liao, very nice..."
3103,"1) Go to write msg 2) Put on Dictionary mode 3)Cover the screen with hand, 4)Press  &lt;#&gt; . 5)Gently remove Ur hand.. Its interesting..:)"
3104,Well you told others you'd marry them...
3105,"Not really dude, have no friends i'm afraid :("
3106,Oh k. . I will come tomorrow
3107,Just haven't decided where yet eh ?
3108,Dont flatter yourself... Tell that man of mine two pints of carlin in ten minutes please.... 
3109,it's really getting me down just hanging around.
3110,Am in film ill call you later.
3111,I got your back! Do you have any dislikes in bed?
3112,Same as kallis dismissial in 2nd test:-).
3113,"Oops, I'll let you know when my roommate's done"
3114,Ok lor but not too early. Me still having project meeting now.
3115,"Night night, see you tomorrow"
3116,Is it your yahoo boys that bring in the perf? Or legal.
3117,Eh u send wrongly lar...
3118,LOOK AT THE FUCKIN TIME. WHAT THE FUCK YOU THINK IS UP
3119,"\Hey! do u fancy meetin me at 4 at cha åÐ hav a lil beverage on me. if not txt or ring me and we can meet up l8r. quite tired got in at 3 v.pist ;) love Pete x x x\"""""
3120,Lmao. Take a pic and send it to me.
3121,"Just got some gas money, any chance you and the gang want to go on a grand nature adventure?"
3122,have you ever had one foot before?
3123,Convey my regards to him
3124,Dear where you. Call me
3125,"Geeee ... I miss you already, you know ? Your all I can think about. Fuck, I can't wait till next year when we will be together ... *loving kiss*"
3126,I got a call from a landline number. . . I am asked to come to anna nagar . . . I will go in the afternoon
3127,"Alright, we're all set here, text the man"
3128,Eat jap done oso aft ur lect wat... ÌÏ got lect at 12 rite... 
3129,"Hello, hello, hi lou sorry it took so long 2 reply- I left mobile at friends in Lancaster, just got it bak Neway im sorry I couldnåÕt make ur båÕday 2 hun!"
3130,i dnt wnt to tlk wid u
3131,R u over scratching it?
3132,A guy who gets used but is too dumb to realize it.
3133,Mystery solved! Just opened my email and he's sent me another batch! Isn't he a sweetie
3134,"Ugh y can't u just apologize, admit u were wrong and ask me to take u back?"
3135,Nutter. Cutter. Ctter. Cttergg. Cttargg. Ctargg. Ctagg. ie you
3136,Ok i wont call or disturb any one. I know all are avoiding me. I am a burden for all
3137,Free entry in 2 a wkly comp to win FA Cup final tkts 21st May 2005. Text FA to 87121 to receive entry question(std txt rate)T&C's apply 08452810075over18's
3138,Lara said she can loan me  &lt;#&gt; .
3139,"Today's Offer! Claim ur å£150 worth of discount vouchers! Text YES to 85023 now! SavaMob, member offers mobile! T Cs 08717898035. å£3.00 Sub. 16 . Unsub reply X"
3140,Hi Chachi tried calling u now unable to reach u .. Pl give me a missed cal once u c tiz msg  Kanagu
3141,He is world famamus....
3142,New TEXTBUDDY Chat 2 horny guys in ur area 4 just 25p Free 2 receive Search postcode or at gaytextbuddy.com. TXT ONE name to 89693. 08715500022 rpl Stop 2 cnl
3143,As a Registered Subscriber yr draw 4 a å£100 gift voucher will b entered on receipt of a correct ans. When are the next olympics. Txt ans to 80062
3144,You want to go? 
3145,Please tell me not all of my car keys are in your purse
3146,Really? I crashed out cuddled on my sofa.
3147,Of cos can lar i'm not so ba dao ok... 1 pm lor... Y u never ask where we go ah... I said u would ask on fri but he said u will ask today...
3148,"Wow. I never realized that you were so embarassed by your accomodations. I thought you liked it, since i was doing the best i could and you always seemed so happy about \the cave\"". I'm sorry I didn't and don't have more to give. I'm sorry i offered. I'm sorry your room was so embarassing."""
3149,"Hey, can you tell me blake's address? Carlos wanted me to meet him there but I got lost and he's not answering his phone"
3150,Pls go there today  &lt;#&gt; . I dont want any excuses
3151,ÌÏ give me some time to walk there.
3152,Depends on where u going lor.
3153,"Since when, which side, any fever, any vomitin."
3154,I'm stuck in da middle of da row on da right hand side of da lt... 
3155,Have a good evening! Ttyl
3156,"'An Amazing Quote'' - \Sometimes in life its difficult to decide whats wrong!! a lie that brings a smile or the truth that brings a tear....\"""""
3157,"Haha... Where got so fast lose weight, thk muz go 4 a month den got effect... Gee,later we go aust put bk e weight."
3158,"We know TAJ MAHAL as symbol of love. But the other lesser known facts 1. Mumtaz was Shahjahan's 4th wife, out of his 7 wifes. 2. Shahjahan killed Mumtaz's husband to marry her. 3. Mumtaz died in her  &lt;#&gt; th delivery. 4. He then married Mumtaz's sister. Question arises where the Hell is the LOVE?:-| -The Great Hari-"
3159,Yoyyooo u know how to change permissions for a drive in mac. My usb flash drive
3160,Today my system sh get ready.all is well and i am also in the deep well
3161,"I'm gonna be home soon and i don't want to talk about this stuff anymore tonight, k? I've cried enough today."
3162,Uhhhhrmm isnt having tb test bad when youre sick
3163,Ok good then i later come find Ì_... C lucky i told Ì_ to go earlier... Later pple take finish Ì_ no more again...
3164,"sure, but make sure he knows we ain't smokin yet"
3165,S.i'm watching it in live..
3166,Hope youåÕre not having too much fun without me!! see u tomorrow love jess x
3167,"FREE2DAY sexy St George's Day pic of Jordan!Txt PIC to 89080 dont miss out, then every wk a saucy celeb!4 more pics c PocketBabe.co.uk 0870241182716 å£3/wk"
3168,Thats cool princess! I will cover your face in hot sticky cum :)
3169,You are a big chic. Common. Declare
3170,What's your room number again? Wanna make sure I'm knocking on the right door
3171,Yo chad which gymnastics class do you wanna take? The site says Christians class is full..
3172,I WILL CAL YOU SIR. In meeting
3173,True dear..i sat to pray evening and felt so.so i sms'd you in some time...
3174,Does she usually take fifteen fucking minutes to respond to a yes or no question
3175,Whats the staff name who is taking class for us?
3176,IM GONNA MISS U SO MUCH
3177,Are you staying in town ?
3178,"Haha yeah I see that now, be there in a sec"
3179,says the  &lt;#&gt;  year old with a man and money. I'm down to my last  &lt;#&gt; . Still waiting for that check.
3180,Hi where you. You in home or calicut?
3181,Was just about to ask. Will keep this one. Maybe that's why you didn't get all the messages we sent you on glo
3182,S da..al r above  &lt;#&gt;
3183,Please tell me you have some of that special stock you were talking about
3184,Aight well keep me informed
3185,Oh k k:)but he is not a big hitter.anyway good
3186,"Hungry gay guys feeling hungry and up 4 it, now. Call 08718730555 just 10p/min. To stop texts call 08712460324 (10p/min)"
3187,Watching tv now. I got new job :)
3188,Already one guy loving you:-.
3189,"Night has ended for another day, morning has come in a special way. May you smile like the sunny rays and leaves your worries at the blue blue bay."
3190,U don't remember that old commercial?
3191,"Yes, i'm small kid.. And boost is the secret of my energy.."
3192,You also didnt get na hi hi hi hi hi
3193,I borrow ur bag ok.
3194,Excellent! Wish we were together right now!
3195,Don't forget though that I love you .... And I walk beside you. Watching over you and keeping your heart warm.
3196,The bus leaves at  &lt;#&gt; 
3197,Anything lar...
3198,Then any special there?
3199,Good Morning my Dear........... Have a great &amp; successful day.
3200,Wish i were with you now!
3201,Today is ACCEPT DAY..U Accept me as? Brother Sister Lover Dear1 Best1 Clos1 Lvblefrnd Jstfrnd Cutefrnd Lifpartnr Belovd Swtheart Bstfrnd No rply means enemy
3202,"Im sorry bout last nite it wasnåÕt ur fault it was me, spouse it was pmt or sumthin! U 4give me? I think u shldxxxx"
3203,"Sorry, I'll call later"
3204,URGENT We are trying to contact you Last weekends draw shows u have won a å£1000 prize GUARANTEED Call 09064017295 Claim code K52 Valid 12hrs 150p pm
3205,"I'll see, but prolly yeah"
3206,Burger King - Wanna play footy at a top stadium? Get 2 Burger King before 1st Sept and go Large or Super with Coca-Cola and walk out a winner
3207,When u wana see it then
3208,If you were/are free i can give. Otherwise nalla adi entey nattil kittum
3209,I sent lanre fakeye's Eckankar details to the mail box
3210,Anything lor... U decide...
3211,"URGENT. Important information for 02 user. Today is your lucky day! 2 find out why , log onto http://www.urawinner.com there is a fantastic surprise awaiting you !"
3212,"He said that he had a right giggle when he saw u again! You would possibly be the first person2die from NVQ, but think how much you could for! "
3213,if you aren't here in the next  &lt;#&gt;  hours imma flip my shit
3214,Why de. You looking good only:-)..
3215,Sorry da thangam.it's my mistake.
3216,"K give me a sec, breaking a  &lt;#&gt;  at cstore"
3217,I called and said all to him:)then he have to choose this future.
3218,Get your garden ready for summer with a FREE selection of summer bulbs and seeds worth å£33:50 only with The Scotsman this Saturday. To stop go2 notxt.co.uk
3219,Your account has been refilled successfully by INR  &lt;DECIMAL&gt; . Your KeralaCircle prepaid account balance is Rs  &lt;DECIMAL&gt; . Your Transaction ID is KR &lt;#&gt; .
3220,Your bill at 3 is å£33.65 so thats not bad!
3221,"Dear Matthew please call 09063440451 from a landline, your complimentary 4*Lux Tenerife holiday or å£1000 CASH await collection. ppm150 SAE T&Cs Box334 SK38XH."
3222,SMS SERVICES For your inclusive text credits pls gotto www.comuk.net login 3qxj9 unsubscribe with STOP no extra charge help 08702840625 comuk.220cm2 9AE
3223,"* Was really good to see you the other day dudette, been missing you!"
3224,"Just got part Nottingham - 3 hrs 63miles. Good thing i love my man so much, but only doing 40mph. Hey ho"
3225,Hahaha..use your brain dear
3226,Are you angry with me. What happen dear
3227,Hi' Test on  &lt;#&gt; rd ....
3228,My love ... I hope your not doing anything drastic. Don't you dare sell your pc or your phone ...
3229,New TEXTBUDDY Chat 2 horny guys in ur area 4 just 25p Free 2 receive Search postcode or at gaytextbuddy.com. TXT ONE name to 89693
3230,oh ya... Got hip hop open. Haha i was thinking can go for jazz then zoom to cine... Actually tonight i'm free leh... And there's a kb lesson tonight
3231,Huh so late... Fr dinner?
3232,You still around? I could use a half-8th
3233,"If you can make it any time tonight or whenever you can it's cool, just text me whenever you're around"
3234,I am on the way to ur home
3235,"FREE RINGTONE text FIRST to 87131 for a poly or text GET to 87131 for a true tone! Help? 0845 2814032 16 after 1st free, tones are 3xå£150pw to eå£nd txt stop"
3236,Please attend the phone:)
3237,Didn't you get hep b immunisation in nigeria.
3238,"My Parents, My Kidz, My Friends n My Colleagues. All screaming.. SURPRISE !! and I was waiting on the sofa.. ... ..... ' NAKED...!"
3239,Also fuck you and your family for going to rhode island or wherever the fuck and leaving me all alone the week I have a new bong &gt;:(
3240,"Sorry, left phone upstairs. OK, might be hectic but would be all my birds with one fell swoop. It's a date."
3241,"Aldrine, rakhesh ex RTM here.pls call.urgent."
3242,There is a first time for everything :)
3243,Err... Cud do. I'm going to  at 8pm. I haven't got a way to contact him until then.
3244,Got it..mail panren paru..
3245,I will be gentle baby! Soon you will be taking all  &lt;#&gt;  inches deep inside your tight pussy...
3246,"Honeybee Said: *I'm d Sweetest in d World* God Laughed &amp; Said: *Wait,U Havnt Met d Person Reading This Msg* MORAL: Even GOD Can Crack Jokes! GM+GN+GE+GN:)"
3247,How are you. Its been ages. How's abj
3248,"Sorry, I'll call later"
3249,Finally the match heading towards draw as your prediction.
3250,Huh? 6 also cannot? Then only how many mistakes?
3251,Just chill for another 6hrs. If you could sleep the pain is not a surgical emergency so see how it unfolds. Okay
3252,"Aight, call me once you're close"
3253,Yes. Last  practice
3254,"You can stop further club tones by replying \STOP MIX\"" See my-tone.com/enjoy. html for terms. Club tones cost GBP4.50/week. MFL"
3255,I'm reading the text i just sent you. Its meant to be a joke. So read it in that light
3256,Ew are you one of them?
3257,Wishing you a wonderful week.
3258,Uncle Abbey! Happy New Year. Abiola
3259,The guy did some bitching but I acted like i'd be interested in buying something else next week and he gave it to us for free
3260,Should I be stalking u?
3261,"Want to funk up ur fone with a weekly new tone reply TONES2U 2 this text. www.ringtones.co.uk, the original n best. Tones 3GBP network operator rates apply"
3262,"Dad wanted to talk about the apartment so I got a late start, omw now"
3263,"Fighting with the world is easy, u either win or lose bt fightng with some1 who is close to u is dificult if u lose - u lose if u win - u still lose."
3264,"Hmmm.. Thk sure got time to hop ard... Ya, can go 4 free abt... Muz call u to discuss liao... "
3265,How are you enjoying this semester? Take care brother.
3266,"Probably not, I'm almost out of gas and I get some cash tomorrow"
3267,Customer Loyalty Offer:The NEW Nokia6650 Mobile from ONLY å£10 at TXTAUCTION! Txt word: START to No: 81151 & get yours Now! 4T&Ctxt TC 150p/MTmsg
3268,Buy one egg for me da..please:)
3269,Hope you are having a good week. Just checking in
3270,Aslamalaikkum....insha allah tohar beeen muht albi mufti mahfuuz...meaning same here....
3271,"Urgent! call 09061749602 from Landline. Your complimentary 4* Tenerife Holiday or å£10,000 cash await collection SAE T&Cs BOX 528 HP20 1YF 150ppm 18+"
3272,Your gonna have to pick up a $1 burger for yourself on your way home. I can't even move. Pain is killing me.
3273,Oh yes I can speak txt 2 u no! Hmm. Did u get  email?
3274,Ok no prob...
3275,"Argh my 3g is spotty, anyway the only thing I remember from the research we did was that province and sterling were the only problem-free places we looked at"
3276,Hi:)cts employee how are you?
3277,As per your request 'Melle Melle (Oru Minnaminunginte Nurungu Vettam)' has been set as your callertune for all Callers. Press *9 to copy your friends Callertune
